{
  "schemaVersion": "1.0.0",
  "id": "fighter",
  "name": "Fighter",
  "iconAsset": "assets/emblems/fighter.png",
  "stats": {
    "adaptiveAttack": 22,
    "physicalDefense": 6,
    "magicDefense": 6,
    "spellVampPct": 10
  },
  "sources": [
    {
      "field": "stats",
      "url": "https://mobile-legends.fandom.com/wiki/Emblems",
      "retrieved": "2026-06-29"
    }
  ]
}
