{
  "schemaVersion": "1.0.0",
  "id": "mage",
  "name": "Mage",
  "iconAsset": "assets/emblems/mage.png",
  "stats": {
    "magicPower": 30,
    "magicPenetrationFlat": 8,
    "cooldownReductionPct": 5
  },
  "sources": [
    {
      "field": "stats",
      "url": "https://mobile-legends.fandom.com/wiki/Emblems",
      "retrieved": "2026-06-29"
    }
  ]
}
