{
  "schemaVersion": "1.0.0",
  "id": "common",
  "name": "Common",
  "iconAsset": "assets/emblems/common.png",
  "stats": {
    "hp": 275,
    "adaptiveAttack": 22,
    "hpRegen": 12
  },
  "sources": [
    {
      "field": "stats",
      "url": "https://mobile-legends.fandom.com/wiki/Emblems",
      "retrieved": "2026-06-29"
    }
  ]
}
