{
  "schemaVersion": "1.0.0",
  "id": "assassin",
  "name": "Assassin",
  "iconAsset": "assets/emblems/assassin.png",
  "stats": {
    "adaptiveAttack": 10,
    "adaptivePenetration": 14,
    "movementSpeedPct": 3
  },
  "sources": [
    {
      "field": "stats",
      "url": "https://mobile-legends.fandom.com/wiki/Emblems",
      "retrieved": "2026-06-29"
    }
  ]
}
