{
  "schemaVersion": "1.0.0",
  "id": "marksman",
  "name": "Marksman",
  "iconAsset": "assets/emblems/marksman.png",
  "stats": {
    "adaptiveAttack": 16,
    "attackSpeedPct": 15,
    "lifestealPct": 5
  },
  "sources": [
    {
      "field": "stats",
      "url": "https://mobile-legends.fandom.com/wiki/Emblems",
      "retrieved": "2026-06-29"
    }
  ]
}
